{
  "allowed_scope": [
    "OFFLINE_SPREAD_DEPTH_IMBALANCE_ANALYSIS",
    "ABSOLUTE_SPREAD_CALCULATION",
    "SPREAD_BPS_CALCULATION",
    "MID_PRICE_CALCULATION",
    "MICROPRICE_CALCULATION",
    "DEPTH_BY_VERSIONED_BPS_BAND",
    "CUMULATIVE_DEPTH_CALCULATION",
    "SYMMETRIC_IMBALANCE_WITH_ZERO_DENOMINATOR_HANDLING",
    "FEATURE_PUBLICATION_BY_HORIZON_AND_LEVEL",
    "BOOK_QUALITY_BINDING",
    "NO_EXTRAPOLATION_BEYOND_OBSERVED_DEPTH",
    "BOOK_FEATURE_STATE_V1",
    "VERSIONED_CONFIG_AND_LINEAGE_BINDING",
    "DETERMINISTIC_STATE_AUDIT_PERSISTENCE",
    "NEGATIVE_AND_FORBIDDEN_CAPABILITY_VALIDATION",
    "FULL_CHAIN_VALIDATION_UNTIL_LOT41"
  ],
  "base_commit": "20975b505c7f8b527751fb5d3bce034c6e55dcc2",
  "canonical_roadmap": {
    "lot_id": "Lot 41",
    "source_blob_sha": "84de51bda788a8d124fb7d344419c4a4b12030b5",
    "source_line": 42,
    "source_path": "data/audit/product_scope_roadmap_lot21.jsonl",
    "title": "Spread, Depth & Imbalance Engine",
    "version_id": "V4_MICROSTRUCTURE_LIQUIDITY"
  },
  "current_version": "0.40.0",
  "forbidden_scope": [
    "EXTERNAL_NETWORK_ACCESS",
    "LIVE_EXCHANGE_DATA",
    "REAL_CREDENTIALS",
    "NETWORK_INGESTION",
    "LIQUIDITY_ZONE_WALL_VOID_INFERENCE",
    "BOOK_RESILIENCE_REPLENISHMENT_ENGINE",
    "TRADE_AGGRESSOR_CLASSIFICATION",
    "ORDER_FLOW_DELTA_CVD_ENGINE",
    "CLASSIFICATION_CONFIDENCE_ENGINE",
    "ABSORPTION_HIDDEN_LIQUIDITY_INFERENCE",
    "VOLUME_CLUSTER_TIME_AT_LEVEL_ENGINE",
    "STOP_ZONE_LIQUIDITY_POOL_INFERENCE",
    "SWEEP_FAKEOUT_TRAP_FAILED_AUCTION_ENGINE",
    "DERIVATIVES_CONTEXT_ENGINE",
    "GAME_THEORY_SCENARIO_AGGREGATION",
    "PARTICIPANT_INTENT_AS_FACT",
    "SCENARIO_TO_SIGNAL_CONVERSION",
    "FORECAST_GENERATION",
    "SIGNAL_GENERATION",
    "RISK_APPROVAL",
    "ORDER_ROUTING",
    "TRADING",
    "EXECUTION"
  ],
  "gate_status": "GO_LOT41_IMPLEMENTATION_ENTRY",
  "human_decision": "APPROVED_START_LOT41",
  "implementation_started": false,
  "next_lot": 42,
  "next_lot_status": "PLANNED_LOCKED",
  "output_checksum": "1d3fab39fde8c92ed7c94af1b722b5f877d56663f28f856b603de7f3e31a8efe",
  "owner": "MicrostructureDomain",
  "prerequisites": {
    "anti_flake_repetitions": 3,
    "branch_coverage_percent": 91.24,
    "latest_implemented_lot": 40,
    "line_coverage_percent": 97.31,
    "lot40_audit_checksum": "978e910d326e6895b652e256f980bc33203092157334ebe3824ebbf31da1632c",
    "lot40_book_health_score": "100",
    "lot40_book_health_veto_checksum": "000613129dbce4bfa189f66a9927c442a557556870381de92aa2b8da8a7951fc",
    "lot40_book_integrity_checksum": "35b9941782811766762eea067fea53f7c026fbe9ea8699f911c34d648b409d2a",
    "lot40_evidence_head": "ea04fe826261eeed5a59eea60265b38b68404b6b",
    "lot40_final_pr_head": "1268772c07cbb76c18b3267aef12dad5ba58af31",
    "lot40_health_consequence": "NONE",
    "lot40_health_status": "HEALTHY",
    "lot40_implementation_merge": "88f0dac660e262a1c468d9cd75c5e7996ce4817b",
    "lot40_post_merge_audit_merge_commit": "20975b505c7f8b527751fb5d3bce034c6e55dcc2",
    "lot40_post_merge_verdict": "GO_LOT40_POST_MERGE",
    "lot40_source_head": "b9a18a8aaef858b985c3f75ef2aa8955ec521e9f",
    "lot40_state_checksum": "e601f60e8fad70c4c445955dda503a3b728614936ca17c964cb2ed9c8a927477",
    "lot40_status": "IMPLEMENTED_VALIDATED_OFFLINE_BOOK_INTEGRITY_ONLY",
    "lot41_capability_status": "PLANNED_LOCKED",
    "mutation_score_percent": 82.32,
    "reference_reconstructed_sequence_id": 1003
  },
  "quality_gates": {
    "anti_flake_repetitions": 3,
    "branch_coverage_min_percent": 90,
    "line_coverage_min_percent": 95,
    "mutation_score_min_percent": 80
  },
  "required_inputs": [
    "RunContextV1 (run_id, runtime_mode, config_version, code_commit, correlation_id)",
    "LineageEnvelopeV1 des artefacts produits par les lots préalables"
  ],
  "required_outputs": [
    "SpreadDepthImbalanceEngineStateV1",
    "SpreadDepthImbalanceEngineAuditV1",
    "BookFeatureStateV1"
  ],
  "runtime_mode": "OFFLINE_MICROSTRUCTURE_RESEARCH_ONLY",
  "safety": {
    "analysis_only": true,
    "approved_size": 0,
    "execution_allowed": false,
    "external_connectivity_allowed": false,
    "market_event_publication_allowed": false,
    "network_ingestion_allowed": false,
    "order_routing_allowed": false,
    "participant_behavior_inference_explicitly_labeled": true,
    "raw_data_mutation_allowed": false,
    "real_credentials_allowed": false,
    "risk_approval_allowed": false,
    "scenario_score_is_signal": false,
    "signal_generation_allowed": false,
    "trade_allowed": false,
    "used_for_decision": false
  },
  "schema_version": "lot41-v4-entry-gate-v1",
  "target_lot": 41
}
